Category URL,Title,Selling Price,MRP,Discount,Rating
https://www.bewakoof.com/women-pajamas,Women's White All Over Printed Oversized Pyjamas,₹449,"₹1,549",71% OFF,4.4
https://www.bewakoof.com/women-pajamas,Women's Blue Tweety All Over Printed Wide Leg Pyjamas,₹799,"₹1,299",38% OFF,4.4
https://www.bewakoof.com/women-pajamas,Women's Purple All Over Printed Wide Leg Pyjamas,₹799,"₹1,799",55% OFF,4.4
https://www.bewakoof.com/women-pajamas,Women's Off White All Over Printed Wide Leg Pyjamas,₹699,"₹1,799",61% OFF,4.4
https://www.bewakoof.com/women-pajamas,Women's Grey All Over Printed Pyjamas,₹599,"₹1,799",66% OFF,4.4
https://www.bewakoof.com/women-pajamas,Women's Purple All Over Printed Wide Leg Pyjamas,₹799,"₹1,499",46% OFF,4.4
https://www.bewakoof.com/women-shorts,Women's Jet Black Oversized Shorts,₹549,"₹1,799",69% OFF,4.5
https://www.bewakoof.com/women-shorts,Women's Green Skorts,₹569,"₹1,899",70% OFF,4.5
https://www.bewakoof.com/women-shorts,Women's Blue Oversized Cotton Linen Shorts,₹629,"₹2,099",70% OFF,4.5
https://www.bewakoof.com/women-shorts,Women's Black Shorts,₹599,"₹1,299",53% OFF,4.5
https://www.bewakoof.com/women-shorts,Women's Blue & White All Over Printed Skorts,₹539,"₹2,099",74% OFF,4.5
https://www.bewakoof.com/women-shorts,Women's Multicolor All Over Printed Skorts,₹599,"₹2,099",71% OFF,4.5
https://www.bewakoof.com/women-shorts,Women's White & Black All Over Printed Shorts,₹579,₹999,42% OFF,4.5
https://www.bewakoof.com/women-shorts,Women's Purple Shorts,₹449,"₹1,799",75% OFF,4.5
https://www.bewakoof.com/women-shorts,Women's Grey Oversized Shorts,₹499,"₹1,799",72% OFF,4.5
https://www.bewakoof.com/women-shorts,Women's Taupe Brown Shorts,₹499,"₹1,799",72% OFF,4.5
https://www.bewakoof.com/women-shorts,Women's Off White All Over Printed Shorts,₹629,₹999,37% OFF,4.5
https://www.bewakoof.com/women-shorts,Women's Black & Orange All Over Printed Skorts,₹499,"₹1,899",73% OFF,4.5
https://www.bewakoof.com/women-shorts,Women's Purple Shorts,₹399,"₹1,499",73% OFF,4.5
https://www.bewakoof.com/women-shorts,Women's Pink Shorts,₹499,"₹1,799",72% OFF,4.5
https://www.bewakoof.com/women-shorts,Women's Taupe Brown Shorts,₹549,"₹1,799",69% OFF,4.5
https://www.bewakoof.com/women-shorts,Women's Green Oversized Cotton Linen Shorts,₹629,"₹2,099",70% OFF,4.5
https://www.bewakoof.com/women-shorts,Women's Blue Wide Shorts,₹399,"₹1,599",75% OFF,4.5
https://www.bewakoof.com/women-shorts,Women's Black Carpenter Shorts,₹499,"₹2,099",76% OFF,4.5
https://www.bewakoof.com/women-shorts,Women's Chocolate Brown Shorts,₹589,"₹2,299",74% OFF,4.5
https://www.bewakoof.com/women-shorts,Women's White & Green All Over Printed Skorts,₹529,"₹1,899",72% OFF,4.5
https://www.bewakoof.com/women-boxer-shorts,Women's Grey Boxer Shorts,₹399,₹699,42% OFF,4.4
https://www.bewakoof.com/women-boxer-shorts,Women's Black Boxer Shorts,₹399,₹699,42% OFF,4.4
https://www.bewakoof.com/women-boxer-shorts,Women's Blue Boxer Shorts,₹349,₹699,50% OFF,4.4
https://www.bewakoof.com/women-co-ord-sets,Women's Pink Oversized Co-ordinates,₹809,"₹3,199",74% OFF,4.5
https://www.bewakoof.com/women-co-ord-sets,Women's Blue Minion Blue Cord Graphic Printed Oversized Co-Ord Set,₹849,"₹2,949",71% OFF,4.5
https://www.bewakoof.com/women-co-ord-sets,Women's Blue Oversized Co-ordinates,₹899,"₹3,199",71% OFF,4.5
https://www.bewakoof.com/women-co-ord-sets,Women's Black Oversized Co-ordinates,₹899,"₹3,199",71% OFF,4.5
https://www.bewakoof.com/women-co-ord-sets,Women's Multicolor All Over Printed Co-ordinates,₹799,"₹2,499",68% OFF,4.5
https://www.bewakoof.com/women-co-ord-sets,Women's Green Oversized Co-ordinates,₹799,"₹3,199",75% OFF,4.5
https://www.bewakoof.com/women-co-ord-sets,Women's Black & Blue All Over Printed Co-ordinates,₹699,"₹2,499",72% OFF,4.5
https://www.bewakoof.com/women-co-ord-sets,Women's Black All Over Printed Co-ordinates,₹699,"₹2,499",72% OFF,4.5
https://www.bewakoof.com/women-co-ord-sets,Women's Black Bored Typography Co-ordinates,"₹1,059","₹3,449",69% OFF,4.5
https://www.bewakoof.com/women-co-ord-sets,Women's Black & White Problem Child Graphic Printed Oversized Co-ordinates,₹899,"₹3,199",71% OFF,4.5
https://www.bewakoof.com/women-co-ord-sets,Women's Black Super Loose Fit Co-ordinates,"₹1,009","₹2,999",66% OFF,4.5
https://www.bewakoof.com/women-co-ord-sets,Women's Orange Super Loose Fit Co-ordinates,₹979,"₹2,999",67% OFF,4.5
https://www.bewakoof.com/women-co-ord-sets,Women's Purple Super Loose Fit Co-ordinates,₹949,"₹2,999",68% OFF,4.5
https://www.bewakoof.com/women-co-ord-sets,Women's Green Super Loose Fit Co-ordinates,"₹1,019","₹2,999",66% OFF,4.5
https://www.bewakoof.com/women-co-ord-sets,Women's Green Tweety Graphic Printed Co-ordinates,"₹1,059","₹3,349",68% OFF,4.5
https://www.bewakoof.com/women-co-ord-sets,Women's Skipper Blue LMAO Graphic Printed Co-ordinates,₹949,"₹3,349",71% OFF,4.5
https://www.bewakoof.com/women-co-ord-sets,Women's Gardenia Super Loose Fit Co-ordinates,"₹1,019","₹2,999",66% OFF,4.5
https://www.bewakoof.com/women-co-ord-sets,Women's Black Dragon Graphic Printed Co-ordinates,₹949,"₹3,349",71% OFF,4.5
https://www.bewakoof.com/windcheaters-for-women,Women's White & Red Color Block Oversized Windcheater Jacket,₹999,"₹3,199",68% OFF,4.4
https://www.bewakoof.com/windcheaters-for-women,Women's Purple Oversized Hooded Windcheater Jacket,₹929,"₹2,899",67% OFF,4.4
https://www.bewakoof.com/windcheaters-for-women,Women's Navy Blue Oversized Hooded Windcheater Jacket,₹989,"₹3,599",72% OFF,4.4
https://www.bewakoof.com/windcheaters-for-women,Women's White Oversized Hooded Windcheater Jacket,₹929,"₹2,899",67% OFF,4.4
https://www.bewakoof.com/windcheaters-for-women,Women's Lime Green Color Block Windcheater Jacket,₹799,"₹2,699",70% OFF,4.4
https://www.bewakoof.com/windcheaters-for-women,Women's Peach Oversized Hooded Windcheater Jacket,₹959,"₹3,599",73% OFF,4.4
https://www.bewakoof.com/windcheaters-for-women,Women's White Hype Mart Typography Oversized Windcheater Jacket,₹799,"₹3,199",75% OFF,4.4
https://www.bewakoof.com/windcheaters-for-women,Women's Yellow & Black Color Block Windcheater Jacket,₹799,"₹2,099",61% OFF,4.4
https://www.bewakoof.com/baggy-jeans-for-women?manufacturer_brand=bewakoof%C2%AE,Women's Blue Washed Baggy Wide Leg Korean Jeans,"₹1,499","₹2,899",48% OFF,4.4
https://www.bewakoof.com/baggy-jeans-for-women?manufacturer_brand=bewakoof%C2%AE,Women's Blue Washed Baggy Wide Leg Jeans,"₹1,499","₹2,899",48% OFF,4.4
https://www.bewakoof.com/baggy-jeans-for-women?manufacturer_brand=bewakoof%C2%AE,Women's Black Baggy Straight Fit Jeans,"₹1,499","₹2,899",48% OFF,4.4
https://www.bewakoof.com/baggy-jeans-for-women?manufacturer_brand=bewakoof%C2%AE,Women's Blue Washed Straight Fit Jeans,"₹1,499","₹2,899",48% OFF,4.4
https://www.bewakoof.com/baggy-jeans-for-women?manufacturer_brand=bewakoof%C2%AE,Women's Black Straight Fit Cargo Jeans,"₹1,899","₹3,399",44% OFF,4.4
https://www.bewakoof.com/baggy-jeans-for-women?manufacturer_brand=bewakoof%C2%AE,Women's Blue Washed Baggy Straight Fit Distressed Jeans,"₹1,299","₹2,999",56% OFF,4.4
https://www.bewakoof.com/baggy-jeans-for-women?manufacturer_brand=bewakoof%C2%AE,Women's Blue Washed Baggy Straight Fit Jeans,"₹1,499","₹2,899",48% OFF,4.4
https://www.bewakoof.com/baggy-jeans-for-women?manufacturer_brand=bewakoof%C2%AE,Women's Black Baggy Wide Leg Jeans,"₹1,499","₹2,599",42% OFF,4.4
https://www.bewakoof.com/baggy-jeans-for-women?manufacturer_brand=bewakoof%C2%AE,Women's Blue Baggy Straight Fit Jeans,"₹1,049","₹2,899",63% OFF,4.4
https://www.bewakoof.com/baggy-jeans-for-women?manufacturer_brand=bewakoof%C2%AE,Women's Beige Baggy Tapered Fit Jeans,"₹1,199","₹2,899",58% OFF,4.4
https://www.bewakoof.com/baggy-jeans-for-women?manufacturer_brand=bewakoof%C2%AE,Women's White Baggy Distressed Wide Leg Jeans,₹929,"₹2,899",67% OFF,4.4
https://www.bewakoof.com/baggy-jeans-for-women?manufacturer_brand=bewakoof%C2%AE,Women's Black Washed Straight Fit Cargo Jeans,₹999,"₹3,199",68% OFF,4.4
https://www.bewakoof.com/baggy-jeans-for-women?manufacturer_brand=bewakoof%C2%AE,Women's Blue Washed Straight Fit Cargo Jeans,"₹1,089","₹3,399",67% OFF,4.4
https://www.bewakoof.com/baggy-jeans-for-women?manufacturer_brand=bewakoof%C2%AE,Women's Dark Brown Straight Fit Cargo Jeans,"₹1,699","₹3,199",46% OFF,4.4
https://www.bewakoof.com/baggy-jeans-for-women?manufacturer_brand=bewakoof%C2%AE,Women's Blue Washed Baggy Wide Leg Jeans,₹999,"₹2,599",61% OFF,4.4
https://www.bewakoof.com/baggy-jeans-for-women?manufacturer_brand=bewakoof%C2%AE,Women's Brown Baggy Wide Leg Jeans,"₹1,599","₹2,899",44% OFF,4.4
https://www.bewakoof.com/baggy-jeans-for-women?manufacturer_brand=bewakoof%C2%AE,Women's White Baggy Straight Fit Distressed Jeans,₹799,"₹2,999",73% OFF,4.4
https://www.bewakoof.com/baggy-jeans-for-women?manufacturer_brand=bewakoof%C2%AE,Women's Blue Washed Baggy Distressed Jeans,₹899,"₹2,899",68% OFF,4.4
https://www.bewakoof.com/baggy-jeans-for-women?manufacturer_brand=bewakoof%C2%AE,Women's Blue Washed Baggy Stright Fit Cropped Cargo Jeans,₹799,"₹2,999",73% OFF,4.4
https://www.bewakoof.com/baggy-pants-for-women?manufacturer_brand=bewakoof%C2%AE,Women's Black Baggy Oversized Cargo Parachute Pants,"₹1,299","₹2,499",48% OFF,4.4
https://www.bewakoof.com/baggy-pants-for-women?manufacturer_brand=bewakoof%C2%AE,Women's Black Baggy Oversized Cargo Parachute Pants,"₹1,199","₹2,399",50% OFF,4.4
https://www.bewakoof.com/baggy-pants-for-women?manufacturer_brand=bewakoof%C2%AE,Women's Green Baggy Oversized Parachute Pants,₹829,"₹2,399",65% OFF,4.4
https://www.bewakoof.com/baggy-pants-for-women?manufacturer_brand=bewakoof%C2%AE,Women's Off White Baggy Oversized Parachute Pants,₹719,"₹2,299",68% OFF,4.4
https://www.bewakoof.com/baggy-pants-for-women?manufacturer_brand=bewakoof%C2%AE,Women's Blue Baggy Oversized Cargo Parachute Pants,"₹1,199","₹2,399",50% OFF,4.4
https://www.bewakoof.com/baggy-pants-for-women?manufacturer_brand=bewakoof%C2%AE,Women's Black Baggy Oversized Cargo Pants,₹999,"₹2,549",60% OFF,4.4
https://www.bewakoof.com/baggy-pants-for-women?manufacturer_brand=bewakoof%C2%AE,Women's Grey Baggy Super Loose Fit Wide Leg Pants,₹879,"₹2,249",60% OFF,4.4
https://www.bewakoof.com/baggy-pants-for-women?manufacturer_brand=bewakoof%C2%AE,Women's Blue Baggy Oversized Cargo Parachute Pants,₹949,"₹2,749",65% OFF,4.4
https://www.bewakoof.com/baggy-pants-for-women?manufacturer_brand=bewakoof%C2%AE,Women's Purple Baggy Oversized Parachute Pants,₹869,"₹2,399",63% OFF,4.4
https://www.bewakoof.com/baggy-pants-for-women?manufacturer_brand=bewakoof%C2%AE,Women's Pink Baggy Oversized Parachute Pants,₹869,"₹2,149",59% OFF,4.4
https://www.bewakoof.com/baggy-pants-for-women?manufacturer_brand=bewakoof%C2%AE,Women's Green Baggy All Over Printed Oversized Parachute Pants,₹829,"₹2,449",66% OFF,4.4
https://www.bewakoof.com/baggy-pants-for-women?manufacturer_brand=bewakoof%C2%AE,Women's Blue Baggy Oversized Parachute Pants,₹879,"₹2,399",63% OFF,4.4
https://www.bewakoof.com/baggy-pants-for-women?manufacturer_brand=bewakoof%C2%AE,Women's Orange Baggy Oversized Cargo Parachute Pants,₹829,"₹2,399",65% OFF,4.4
https://www.bewakoof.com/baggy-pants-for-women?manufacturer_brand=bewakoof%C2%AE,Women's Green Baggy Oversized Cargo Parachute Pants,"₹1,199","₹2,749",56% OFF,4.4
https://www.bewakoof.com/baggy-pants-for-women?manufacturer_brand=bewakoof%C2%AE,Women's Green Baggy All Over Printed Oversized Cargo Parachute Pants,₹739,"₹2,649",72% OFF,4.4
https://www.bewakoof.com/baggy-pants-for-women?manufacturer_brand=bewakoof%C2%AE,Women's Black Baggy Super Loose Fit Wide Leg Pants,₹869,"₹2,249",61% OFF,4.4
https://www.bewakoof.com/baggy-pants-for-women?manufacturer_brand=bewakoof%C2%AE,Women's Black Baggy Oversized Parachute Pants,₹809,"₹2,399",66% OFF,4.4
https://www.bewakoof.com/baggy-pants-for-women?manufacturer_brand=bewakoof%C2%AE,Women's Khaki Baggy Oversized Cargo Parachute Pants,₹789,"₹2,749",71% OFF,4.4
https://www.bewakoof.com/women-straight-fit-jeans?manufacturer_brand=bewakoof%C2%AE,Women's Blue Straight Fit Jeans,"₹1,199","₹1,299",7% OFF,4.4
https://www.bewakoof.com/women-straight-fit-jeans?manufacturer_brand=bewakoof%C2%AE,Women's Black Applique Straight Fit Washed Jeans,"₹1,499","₹3,599",58% OFF,4.4
https://www.bewakoof.com/women-straight-fit-jeans?manufacturer_brand=bewakoof%C2%AE,Women's Black Applique Straight Fit Washed Jeans,"₹1,299","₹3,599",63% OFF,4.4
https://www.bewakoof.com/women-straight-fit-jeans?manufacturer_brand=bewakoof%C2%AE,Women's Black Baggy Straight Fit Jeans,"₹1,499","₹2,899",48% OFF,4.4
https://www.bewakoof.com/women-straight-fit-jeans?manufacturer_brand=bewakoof%C2%AE,Women's Blue Washed Baggy Straight Fit Jeans,"₹1,499",,,4.4
https://www.bewakoof.com/women-straight-fit-jeans?manufacturer_brand=bewakoof%C2%AE,Women's Jet Black Washed Straight Fit Jeans,"₹1,499","₹3,599",58% OFF,4.4
https://www.bewakoof.com/women-straight-fit-jeans?manufacturer_brand=bewakoof%C2%AE,Women's Blue Washed Straight Fit Jeans,"₹1,499","₹2,899",48% OFF,4.4
https://www.bewakoof.com/women-straight-fit-jeans?manufacturer_brand=bewakoof%C2%AE,Women's Black Straight Fit Cargo Jeans,"₹1,899","₹3,399",44% OFF,4.4
https://www.bewakoof.com/women-straight-fit-jeans?manufacturer_brand=bewakoof%C2%AE,Women's Light Blue Washed Baggy Straight Fit Jeans,"₹1,499","₹3,799",60% OFF,4.4
https://www.bewakoof.com/women-straight-fit-jeans?manufacturer_brand=bewakoof%C2%AE,Women's Blue Washed Baggy Straight Fit Distressed Jeans,"₹1,299","₹2,999",56% OFF,4.4
https://www.bewakoof.com/women-straight-fit-jeans?manufacturer_brand=bewakoof%C2%AE,Women's Blue Washed Baggy Straight Fit Jeans,"₹1,499","₹2,899",48% OFF,4.4
https://www.bewakoof.com/women-straight-fit-jeans?manufacturer_brand=bewakoof%C2%AE,Women's Blue Applique Straight Fit Washed Jeans,"₹1,399","₹3,699",62% OFF,4.4
https://www.bewakoof.com/women-straight-fit-jeans?manufacturer_brand=bewakoof%C2%AE,Women's Dark Blue Washed Baggy Straight Fit Jeans,"₹1,499","₹3,799",60% OFF,4.4
https://www.bewakoof.com/women-straight-fit-jeans?manufacturer_brand=bewakoof%C2%AE,Women's Grey Distressed Washed Straight Fit Jeans,"₹1,299","₹3,999",67% OFF,4.4
https://www.bewakoof.com/women-straight-fit-jeans?manufacturer_brand=bewakoof%C2%AE,Women's Light Blue Washed Straight Fit Cargo Jeans,"₹1,299","₹3,999",67% OFF,4.4
https://www.bewakoof.com/women-straight-fit-jeans?manufacturer_brand=bewakoof%C2%AE,Women's Blue Baggy Straight Fit Jeans,"₹1,049","₹2,899",63% OFF,4.4
https://www.bewakoof.com/women-straight-fit-jeans?manufacturer_brand=bewakoof%C2%AE,Women's Black Distressed Washed Straight Fit Jeans,"₹1,299","₹3,999",67% OFF,4.4
https://www.bewakoof.com/women-straight-fit-jeans?manufacturer_brand=bewakoof%C2%AE,Women's Dark Blue Washed Straight Fit Cargo Jeans,"₹1,499","₹3,999",62% OFF,4.4
https://www.bewakoof.com/women-straight-fit-jeans?manufacturer_brand=bewakoof%C2%AE,Women's Light Blue Washed Straight Fit Distressed Jeans,"₹1,399","₹3,999",65% OFF,4.4
https://www.bewakoof.com/women-straight-fit-jeans?manufacturer_brand=bewakoof%C2%AE,Women's Blue Distressed Washed Straight Fit Jeans,"₹1,349","₹3,999",66% OFF,4.4
