Category URL,Title,Selling Price,MRP,Discount,Rating
https://www.bewakoof.com/womens-denims?manufacturer_brand=bewakoof%C2%AE,Women's Blue Washed Baggy Wide Leg Korean Jeans,"₹1,499","₹2,899",48% OFF,4.4
https://www.bewakoof.com/womens-denims?manufacturer_brand=bewakoof%C2%AE,Women's Blue Washed Baggy Wide Leg Jeans,"₹1,499","₹2,899",48% OFF,4.4
https://www.bewakoof.com/womens-denims?manufacturer_brand=bewakoof%C2%AE,Women's Dark Blue Washed Bootcut Jeans,"₹1,299","₹3,499",62% OFF,4.4
https://www.bewakoof.com/womens-denims?manufacturer_brand=bewakoof%C2%AE,Women's Light Blue Ankle Length Jeans,"₹1,199","₹2,799",57% OFF,4.4
https://www.bewakoof.com/womens-denims?manufacturer_brand=bewakoof%C2%AE,Women's Jet Black Bootcut Jeans,"₹1,199","₹2,999",60% OFF,4.4
https://www.bewakoof.com/womens-denims?manufacturer_brand=bewakoof%C2%AE,Women's Blue Straight Fit Jeans,"₹1,199","₹1,299",7% OFF,4.4
https://www.bewakoof.com/womens-denims?manufacturer_brand=bewakoof%C2%AE,Women's Jet Black Bootcut Jeans,₹899,"₹3,299",72% OFF,4.4
https://www.bewakoof.com/womens-denims?manufacturer_brand=bewakoof%C2%AE,Women's Black Applique Straight Fit Washed Jeans,"₹1,499","₹3,599",58% OFF,4.4
https://www.bewakoof.com/womens-denims?manufacturer_brand=bewakoof%C2%AE,Women's Black Applique Straight Fit Washed Jeans,"₹1,299","₹3,599",63% OFF,4.4
https://www.bewakoof.com/womens-denims?manufacturer_brand=bewakoof%C2%AE,Women's Blue Washed Barrel Fit Jeans,"₹1,199","₹3,999",70% OFF,4.4
https://www.bewakoof.com/womens-denims?manufacturer_brand=bewakoof%C2%AE,Women's Black Baggy Straight Fit Jeans,"₹1,499","₹2,899",48% OFF,4.4
https://www.bewakoof.com/womens-denims?manufacturer_brand=bewakoof%C2%AE,Women's Blue Washed Baggy Straight Fit Jeans,"₹1,499",,,4.4
https://www.bewakoof.com/womens-denims?manufacturer_brand=bewakoof%C2%AE,Women's Jet Black Washed Straight Fit Jeans,"₹1,499","₹3,599",58% OFF,4.4
https://www.bewakoof.com/womens-denims?manufacturer_brand=bewakoof%C2%AE,Women's Blue Washed Straight Fit Jeans,"₹1,499","₹2,899",48% OFF,4.4
https://www.bewakoof.com/womens-denims?manufacturer_brand=bewakoof%C2%AE,Women's Light Blue Washed Flared Korean Jeans,"₹1,299","₹3,599",63% OFF,4.4
https://www.bewakoof.com/womens-denims?manufacturer_brand=bewakoof%C2%AE,Women's Blue Bootcut Jeans,"₹1,199","₹2,999",60% OFF,4.4
https://www.bewakoof.com/womens-denims?manufacturer_brand=bewakoof%C2%AE,Women's Black Straight Fit Cargo Jeans,"₹1,899","₹3,399",44% OFF,4.4
https://www.bewakoof.com/womens-denims?manufacturer_brand=bewakoof%C2%AE,Women's Light Blue Washed Baggy Straight Fit Jeans,"₹1,499","₹3,799",60% OFF,4.4
https://www.bewakoof.com/womens-denims?manufacturer_brand=bewakoof%C2%AE,Women's Blue Washed Baggy Straight Fit Distressed Jeans,"₹1,299","₹2,999",56% OFF,4.4
https://www.bewakoof.com/women-t-shirts,Women's Orange Boyfriend T-shirt,₹399,₹699,42% OFF,4.3
https://www.bewakoof.com/women-t-shirts,Women's White Boyfriend T-shirt,₹399,₹999,60% OFF,4.3
https://www.bewakoof.com/women-t-shirts,Women's Ginger Root Brown Pocket Shine Graphic Printed Boyfriend T-shirt,₹449,"₹1,399",67% OFF,4.3
https://www.bewakoof.com/women-t-shirts,Women's Pink & White Camo Printed Oversized T-shirt,₹599,"₹1,149",47% OFF,4.3
https://www.bewakoof.com/women-t-shirts,Women's Black & White All Over Printed Oversized T-shirt,₹599,₹999,40% OFF,4.3
https://www.bewakoof.com/women-t-shirts,Women's Green Lavender Feels Graphic Printed Oversized T-shirt,₹599,"₹1,399",57% OFF,4.3
https://www.bewakoof.com/women-t-shirts,Women's Red Pocket Jerry Graphic Printed Boyfriend T-shirt,₹499,"₹1,099",54% OFF,4.3
https://www.bewakoof.com/women-t-shirts,Women's White Minimal Believe Typography Boyfriend T-shirt,₹449,"₹1,099",59% OFF,4.3
https://www.bewakoof.com/women-t-shirts,Women's Brick Red Boyfriend T-shirt,₹399,"₹1,299",69% OFF,4.3
https://www.bewakoof.com/women-t-shirts,Women's Black Boyfriend T-shirt,₹399,₹999,60% OFF,4.3
https://www.bewakoof.com/women-t-shirts,Women's Orange Queen Bee Graphic Printed Oversized T-shirt,₹599,"₹1,499",60% OFF,4.3
https://www.bewakoof.com/women-t-shirts,Women's Pink No Worries Graphic Printed Oversized T-shirt,₹699,"₹1,499",53% OFF,4.3
https://www.bewakoof.com/women-t-shirts,Women's Black Patch Minion Graphic Printed Oversized T-shirt,₹599,"₹1,499",60% OFF,4.3
https://www.bewakoof.com/women-t-shirts,Women's Azure Blue Cool Enough Graphic Printed Oversized T-shirt,₹599,"₹1,599",62% OFF,4.3
https://www.bewakoof.com/women-t-shirts,Women's Lilac Bloom Grooving Typography Oversized T-shirt,₹599,"₹1,599",62% OFF,4.3
https://www.bewakoof.com/women-t-shirts,Women's Orange Fresh As A Daisy Graphic Printed Boyfriend T-shirt,₹499,"₹1,299",61% OFF,4.3
https://www.bewakoof.com/women-t-shirts,Women's Black Money Don't Jiggle Graphic Printed Boyfriend T-shirt,₹449,₹999,55% OFF,4.3
https://www.bewakoof.com/women-t-shirts,Women's Orange Skool Graphic Printed Boyfriend T-shirt,₹499,"₹1,299",61% OFF,4.3
https://www.bewakoof.com/women-t-shirts,Women's Red Bonjour Paris Graphic Printed Boyfriend T-shirt,₹449,"₹1,099",59% OFF,4.3
https://www.bewakoof.com/women-t-shirts,Women's Blue Lazy Garfield Graphic Printed Oversized T-shirt,₹649,"₹1,349",51% OFF,4.3
https://www.bewakoof.com/women-shirts?manufacturer_brand=bewakoof%C2%AE,Women's Pink All Over Printed Oversized Shirt,"₹1,499","₹2,799",46% OFF,4.4
https://www.bewakoof.com/women-shirts?manufacturer_brand=bewakoof%C2%AE,Women's Off White All Over Printed Oversized Shirt,"₹1,199","₹2,699",55% OFF,4.4
https://www.bewakoof.com/women-shirts?manufacturer_brand=bewakoof%C2%AE,Women's Black Oversized Crop Cotton Linen Shirt,₹499,"₹1,899",73% OFF,4.4
https://www.bewakoof.com/women-shirts?manufacturer_brand=bewakoof%C2%AE,Women's Multicolor All Over Printed Oversized Shirt,₹999,"₹2,199",54% OFF,4.4
https://www.bewakoof.com/women-shirts?manufacturer_brand=bewakoof%C2%AE,Women's Romance Rose & Beige Pink Panther Graphic Printed Oversized Shirt,"₹1,199","₹2,599",53% OFF,4.4
https://www.bewakoof.com/women-shirts?manufacturer_brand=bewakoof%C2%AE,Women's Blue All Over Printed Oversized Shirt,"₹1,499","₹2,799",46% OFF,4.4
https://www.bewakoof.com/women-shirts?manufacturer_brand=bewakoof%C2%AE,Women's Orange Oversized Cotton Linen Shirt,₹799,"₹1,799",55% OFF,4.4
https://www.bewakoof.com/women-shirts?manufacturer_brand=bewakoof%C2%AE,Women's Blue Oversized Crop Cotton Linen Shirt,₹499,"₹1,699",70% OFF,4.4
https://www.bewakoof.com/women-shirts?manufacturer_brand=bewakoof%C2%AE,Women's Green All Over Printed Oversized Crop Shirt,₹569,"₹1,599",64% OFF,4.4
https://www.bewakoof.com/women-shirts?manufacturer_brand=bewakoof%C2%AE,Women's Red & Black Mickey Checked Oversized Crop Shirt,₹719,"₹1,599",55% OFF,4.4
https://www.bewakoof.com/women-shirts?manufacturer_brand=bewakoof%C2%AE,Women's Green Cargo Crop Shirt,₹549,"₹1,799",69% OFF,4.4
https://www.bewakoof.com/women-shirts?manufacturer_brand=bewakoof%C2%AE,Women's Black Oversized Crop Shirt,₹699,"₹1,499",53% OFF,4.4
https://www.bewakoof.com/women-shirts?manufacturer_brand=bewakoof%C2%AE,Women's White Lead Typography Oversized Crop Shirt,₹709,"₹1,599",55% OFF,4.4
https://www.bewakoof.com/women-shirts?manufacturer_brand=bewakoof%C2%AE,Women's Black Crop Shirt,₹449,"₹1,799",75% OFF,4.4
https://www.bewakoof.com/women-shirts?manufacturer_brand=bewakoof%C2%AE,Women's Multicolor All Over Printed Oversized Crop Shirt,₹499,"₹1,699",70% OFF,4.4
https://www.bewakoof.com/women-shirts?manufacturer_brand=bewakoof%C2%AE,Women's Blue & White All Over Printed Oversized Crop Shirt,₹499,"₹1,699",70% OFF,4.4
https://www.bewakoof.com/women-shirts?manufacturer_brand=bewakoof%C2%AE,Women's Black Oversized Crop Cotton Linen Shirt,₹499,"₹1,699",70% OFF,4.4
https://www.bewakoof.com/women-shirts?manufacturer_brand=bewakoof%C2%AE,Women's Green Oversized Crop Cotton Linen Shirt,₹499,"₹1,699",70% OFF,4.4
https://www.bewakoof.com/women-shirts?manufacturer_brand=bewakoof%C2%AE,Women's Black Oversized Cropped Shirt,₹399,"₹1,399",71% OFF,4.4
https://www.bewakoof.com/sweatshirts-for-women,Women's Beige Crop Zipper Sweatshirt,"₹1,089","₹3,099",64% OFF,4.6
https://www.bewakoof.com/sweatshirts-for-women,Women's Jet Black Crop Zipper Sweatshirt,"₹1,299","₹3,099",58% OFF,4.6
https://www.bewakoof.com/sweatshirts-for-women,Women's Pink Oversized Crop Sweatshirt,₹869,"₹2,399",63% OFF,4.6
https://www.bewakoof.com/sweatshirts-for-women,Women's Salsa Red Oversized Crop Sweatshirt,₹809,"₹2,699",70% OFF,4.6
https://www.bewakoof.com/sweatshirts-for-women,Women's Blarney Green Crop Zipper Sweatshirt,"₹1,089","₹3,099",64% OFF,4.6
https://www.bewakoof.com/sweatshirts-for-women,Women's Tawny Port Maroon Crop Zipper Sweatshirt,"₹1,089","₹3,099",64% OFF,4.6
https://www.bewakoof.com/sweatshirts-for-women,Women's Teal Green Star Girl Graphic Printed Oversized Acid Wash Crop Sweatshirt,"₹1,279","₹4,299",70% OFF,4.6
https://www.bewakoof.com/sweatshirts-for-women,Women's Jet Black Oversized Crop Sweatshirt,₹799,"₹2,399",66% OFF,4.6
https://www.bewakoof.com/sweatshirts-for-women,Women's Jet Black Stranger Things Typography Oversized Plus Size Sweatshirt,"₹1,019","₹3,599",71% OFF,4.6
https://www.bewakoof.com/sweatshirts-for-women,Women's Magenta Floral Printed Oversized Sweatshirt,"₹1,779","₹3,099",42% OFF,4.6
https://www.bewakoof.com/sweatshirts-for-women,Women's Chestnut Brown Embroidered Oversized Sweatshirt,₹969,"₹3,299",70% OFF,4.6
https://www.bewakoof.com/sweatshirts-for-women,Women's Beige & Ginger Root Brown Graphic Printed Oversized Cropped Sweatshirt,₹929,"₹3,599",74% OFF,4.6
https://www.bewakoof.com/sweatshirts-for-women,Women's Green Warm Vibes Only Graphic Printed Sweatshirt,₹829,"₹2,599",68% OFF,4.6
https://www.bewakoof.com/sweatshirts-for-women,Women's Beige Divine Graphic Printed Oversized Sweatshirt,₹969,"₹2,699",64% OFF,4.6
https://www.bewakoof.com/sweatshirts-for-women,Women's Black All Over Printed Oversized Cropped Sweatshirt,₹799,"₹3,399",76% OFF,4.6
https://www.bewakoof.com/sweatshirts-for-women,Women's Teal Green Oversized Acid Wash Crop Sweatshirt,"₹1,019","₹3,799",73% OFF,4.6
https://www.bewakoof.com/sweatshirts-for-women,Women's Magenta Oversized Sweatshirt,₹859,"₹2,799",69% OFF,4.6
https://www.bewakoof.com/sweatshirts-for-women,Women's Bright White Embroidered Oversized Sweatshirt,₹879,"₹2,649",66% OFF,4.6
https://www.bewakoof.com/sweatshirts-for-women,Women's Bright White Embroidered Oversized Plus Size Sweatshirt,"₹1,009","₹3,149",67% OFF,4.6
https://www.bewakoof.com/sweatshirts-for-women,Women's Dark Green Oversized Crop Sweatshirt,₹869,"₹2,399",63% OFF,4.6
https://www.bewakoof.com/women-jackets,Women's Black & Sage Reversible Super Loose Fit Puffer Jacket,"₹1,219","₹4,499",72% OFF,4.5
https://www.bewakoof.com/women-jackets,Women's Black Typography Denim Jacket,"₹1,799","₹5,299",66% OFF,4.5
https://www.bewakoof.com/women-jackets,Women's Black & White All Over Printed Oversized Zipper Puffer Jacket,"₹1,269","₹3,999",68% OFF,4.5
https://www.bewakoof.com/women-jackets,Women's Blue Embroidered Oversized Washed Cropped Denim Jacket,"₹1,409","₹5,299",73% OFF,4.5
https://www.bewakoof.com/women-jackets,Women's Beige Sleeveless Oversized Puffer Jacket,₹849,"₹3,099",72% OFF,4.5
https://www.bewakoof.com/women-jackets,Women's Brown Dramatic Typography Super Loose Fit Jacket,"₹1,109","₹2,499",55% OFF,4.5
https://www.bewakoof.com/women-jackets,Women's White & Red Color Block Oversized Windcheater Jacket,₹999,"₹3,199",68% OFF,4.5
https://www.bewakoof.com/women-jackets,Women's Purple Oversized Hooded Windcheater Jacket,₹929,"₹2,899",67% OFF,4.5
https://www.bewakoof.com/women-jackets,Women's White & Black All Over Printed Oversized Reversible Zipper Crop Puffer Jacket,"₹1,499","₹4,099",63% OFF,4.5
https://www.bewakoof.com/women-jackets,Women's Maroon & White Color Block Varsity Bomber Jacket,₹799,"₹1,199",33% OFF,4.5
https://www.bewakoof.com/women-jackets,Women's Bright White Applique Oversized Cropped Denim Jacket,"₹1,319","₹4,799",72% OFF,4.5
https://www.bewakoof.com/women-jackets,Women's Black Oversized Gilet Jacket,₹899,"₹3,249",72% OFF,4.5
https://www.bewakoof.com/women-jackets,Women's Navy Blue Oversized Hooded Windcheater Jacket,₹989,"₹3,599",72% OFF,4.5
https://www.bewakoof.com/women-jackets,Women's Green Oversized Gilet Jacket,₹854,"₹3,249",73% OFF,4.5
https://www.bewakoof.com/women-jackets,Women's Green Oversized Puffer Jacket,₹764,"₹2,499",69% OFF,4.5
https://www.bewakoof.com/women-jackets,Women's Sage Color Block Oversized Bomber Jacket,₹809,"₹3,799",78% OFF,4.5
https://www.bewakoof.com/women-jackets,Women's White Dramatic Typography Super Loose Fit Jacket,"₹1,319","₹2,499",47% OFF,4.5
https://www.bewakoof.com/women-jackets,Women's White Oversized Hooded Windcheater Jacket,₹929,"₹2,899",67% OFF,4.5
https://www.bewakoof.com/women-jackets,Women's Black & Blue Reversible Oversized Puffer Jacket,"₹1,139","₹4,699",75% OFF,4.5
https://www.bewakoof.com/women-jackets,Women's Brown & White Wierldy in Famous Graphic Printed Oversized Jacket,₹917,"₹2,499",63% OFF,4.5
https://www.bewakoof.com/women-sweaters,Women's Jet Black Oversized Sweater,₹869,"₹3,199",72% OFF,4.5
https://www.bewakoof.com/women-sweaters,Women's Jet Black Oversized Sweater,₹949,"₹3,199",70% OFF,4.5
https://www.bewakoof.com/women-sweaters,Women's Off White & Brown Striped Oversized Crop Sweater,₹739,"₹2,299",67% OFF,4.5
https://www.bewakoof.com/women-sweaters,Women's Black & White Tie & Dye Oversized Crop Sweater,"₹1,089","₹3,999",72% OFF,4.5
https://www.bewakoof.com/women-sweaters,Women's Black Striped Oversized Crop Sweater,₹709,"₹1,899",62% OFF,4.5
https://www.bewakoof.com/women-sweaters,Women's White & Purple Striped Oversized Crop Sweater,₹739,"₹2,299",67% OFF,4.5
https://www.bewakoof.com/women-sweaters,Women's Black Oversized Sweater,₹649,"₹1,899",65% OFF,4.5
https://www.bewakoof.com/women-sweaters,Women's Rolling Hills Striped Oversized Crop Sweater,₹589,"₹1,899",68% OFF,4.5
https://www.bewakoof.com/women-sweaters,Women's Blue Slim Fit Sweater,₹709,"₹2,499",71% OFF,4.5
https://www.bewakoof.com/women-sweaters,Women's Hot Red & Off White Typography Oversized Sweater,₹869,"₹2,799",68% OFF,4.5
https://www.bewakoof.com/women-sweaters,Women's Black All Over Printed Oversized Sweater,₹909,"₹2,749",66% OFF,4.5
https://www.bewakoof.com/women-sweaters,Women's Black & White Striped Oversized Sweater,₹849,"₹3,099",72% OFF,4.5
https://www.bewakoof.com/women-sweaters,Women's Jet Black Oversized Sweater,₹649,"₹2,499",74% OFF,4.5
https://www.bewakoof.com/women-sweaters,Women's White & Black Mickey Color Block Oversized Sweater,₹849,"₹2,599",67% OFF,4.5
https://www.bewakoof.com/women-sweaters,Women's Pink Oversized Flatknit Sweater,₹650,"₹2,199",70% OFF,4.5
https://www.bewakoof.com/women-sweaters,Women's Pink Who Needs People Typography Super Loose Fit Sweater,₹889,"₹2,299",61% OFF,4.5
https://www.bewakoof.com/women-sweaters,Women's Jet Black Embellished Oversized Sweater,"₹1,099","₹3,299",66% OFF,4.5
https://www.bewakoof.com/women-sweaters,Women's Red All Over Printed Oversized Sweater,₹959,"₹3,099",69% OFF,4.5
https://www.bewakoof.com/women-sweaters,Women's Hot Coral Pink All Over Printed Oversized Sweater,₹839,"₹3,099",72% OFF,4.5
https://www.bewakoof.com/women-sweaters,Women's Pastel Lilac High Neck Oversized Crop Sweater,₹476,"₹1,899",74% OFF,4.5
https://www.bewakoof.com/polo-t-shirts-for-women,Women's Pink & White Striped Polo T-shirt,₹549,"₹1,249",56% OFF,4.5
https://www.bewakoof.com/polo-t-shirts-for-women,Women's Blue & Green Striped Polo T-shirt,₹409,"₹1,249",67% OFF,4.5
https://www.bewakoof.com/polo-t-shirts-for-women,Women's Brown & Black Striped Oversized Polo T-shirt,₹409,"₹1,499",72% OFF,4.5
https://www.bewakoof.com/oversized-t-shirts-for-women,Women's Pink & White Camo Printed Oversized T-shirt,₹599,"₹1,149",47% OFF,4.6
https://www.bewakoof.com/oversized-t-shirts-for-women,Women's Black & White All Over Printed Oversized T-shirt,₹599,₹999,40% OFF,4.6
https://www.bewakoof.com/oversized-t-shirts-for-women,Women's Green Lavender Feels Graphic Printed Oversized T-shirt,₹599,"₹1,399",57% OFF,4.6
https://www.bewakoof.com/oversized-t-shirts-for-women,Women's Pink No Worries Graphic Printed Oversized T-shirt,₹699,"₹1,499",53% OFF,4.6
https://www.bewakoof.com/oversized-t-shirts-for-women,Women's Black Patch Minion Graphic Printed Oversized T-shirt,₹599,"₹1,499",60% OFF,4.6
https://www.bewakoof.com/oversized-t-shirts-for-women,Women's Azure Blue Cool Enough Graphic Printed Oversized T-shirt,₹599,"₹1,599",62% OFF,4.6
https://www.bewakoof.com/oversized-t-shirts-for-women,Women's Lilac Bloom Grooving Typography Oversized T-shirt,₹599,"₹1,599",62% OFF,4.6
https://www.bewakoof.com/oversized-t-shirts-for-women,Women's Blue Lazy Garfield Graphic Printed Oversized T-shirt,₹649,"₹1,349",51% OFF,4.6
https://www.bewakoof.com/oversized-t-shirts-for-women,Women's Blue Oversized T-shirt,₹599,₹999,40% OFF,4.6
https://www.bewakoof.com/oversized-t-shirts-for-women,Women's Orange Snoopy Cruisin Graphic Printed Oversized Acid Wash T-shirt,₹539,"₹1,699",68% OFF,4.6
https://www.bewakoof.com/oversized-t-shirts-for-women,Women's Purple Oversized T-shirt,₹599,₹899,33% OFF,4.6
https://www.bewakoof.com/oversized-t-shirts-for-women,Women's Black All Over Printed Oversized T-shirt,₹699,"₹1,199",41% OFF,4.6
https://www.bewakoof.com/oversized-t-shirts-for-women,Women's Brown Sugar Spice Everything Nice Graphic Printed Oversized T-shirt,₹599,"₹1,299",53% OFF,4.6
https://www.bewakoof.com/oversized-t-shirts-for-women,Women's Blue Stardust Soul Graphic Printed Oversized T-shirt,₹599,"₹1,499",60% OFF,4.6
https://www.bewakoof.com/oversized-t-shirts-for-women,Women's Green Be Stupid Odie Graphic Printed Oversized T-shirt,₹599,"₹1,349",55% OFF,4.6
https://www.bewakoof.com/oversized-t-shirts-for-women,Women's Green Friends Quotes Graphic Printed Oversized T-shirt,₹749,"₹1,299",42% OFF,4.6
https://www.bewakoof.com/oversized-t-shirts-for-women,Women's Red Emotional Baggage Graphic Printed Oversized T-shirt,₹599,"₹1,499",60% OFF,4.6
https://www.bewakoof.com/oversized-t-shirts-for-women,Women's Red Tom Chase Graphic Printed Oversized T-shirt,₹649,"₹1,099",40% OFF,4.6
https://www.bewakoof.com/oversized-t-shirts-for-women,Women's Black Bearly Awake Graphic Printed Oversized T-shirt,₹599,"₹1,499",60% OFF,4.6
https://www.bewakoof.com/oversized-t-shirts-for-women,Women's Pink Boba Graphic Printed Oversized T-shirt,₹799,"₹1,699",52% OFF,4.6
https://www.bewakoof.com/classic-t-shirt-for-women,Women's Black One With The Universe Graphic Printed T-shirt,₹399,₹999,60% OFF,4.5
https://www.bewakoof.com/classic-t-shirt-for-women,Women's Black Friends Typography Slim Fit T-shirt,₹499,"₹1,099",54% OFF,4.5
https://www.bewakoof.com/classic-t-shirt-for-women,Women's Black Certified Troublemakers Graphic Printed T-shirt,₹499,"₹1,099",54% OFF,4.5
https://www.bewakoof.com/classic-t-shirt-for-women,Women's Pink T-shirt,₹399,₹799,50% OFF,4.5
https://www.bewakoof.com/classic-t-shirt-for-women,Women's Pink Avoiding Responsibilities Graphic Printed T-shirt,₹499,₹999,50% OFF,4.5
https://www.bewakoof.com/classic-t-shirt-for-women,Women's White Bloom Wildly Graphic Printed Slim Fit T-shirt,₹399,"₹1,099",63% OFF,4.5
https://www.bewakoof.com/classic-t-shirt-for-women,Women's Black Slim Fit T-shirt,₹399,₹999,60% OFF,4.5
https://www.bewakoof.com/classic-t-shirt-for-women,Women's Bold Red Busy Doing Nothing Graphic Printed Slim Fit T-shirt,₹499,"₹1,099",54% OFF,4.5
https://www.bewakoof.com/classic-t-shirt-for-women,Women's Green Sundays We Do Nothing Graphic Printed T-shirt,₹499,₹999,50% OFF,4.5
https://www.bewakoof.com/classic-t-shirt-for-women,Women's Purple Mickey Wink Graphic Printed T-shirt,₹499,"₹1,099",54% OFF,4.5
https://www.bewakoof.com/classic-t-shirt-for-women,Women's Pink & White Striped Polo T-shirt,₹549,"₹1,249",56% OFF,4.5
https://www.bewakoof.com/classic-t-shirt-for-women,Women's Lilac Bloom T-Shirt,₹399,₹699,42% OFF,4.5
https://www.bewakoof.com/classic-t-shirt-for-women,Women's Black Inner Peace Graphic Printed Slim Fit T-shirt,₹399,"₹1,099",63% OFF,4.5
https://www.bewakoof.com/classic-t-shirt-for-women,Women's Blue Slim Fit T-shirt,₹399,₹449,11% OFF,4.5
https://www.bewakoof.com/classic-t-shirt-for-women,Women's Red T-shirt,₹399,₹999,60% OFF,4.5
https://www.bewakoof.com/classic-t-shirt-for-women,Women's Black Cats Coffee And Books Graphic Printed Slim Fit T-shirt,₹399,"₹1,099",63% OFF,4.5
https://www.bewakoof.com/classic-t-shirt-for-women,Women's White Slim Fit T-shirt,₹399,₹999,60% OFF,4.5
https://www.bewakoof.com/classic-t-shirt-for-women,Women's Fog Green T-shirt,₹399,₹599,33% OFF,4.5
https://www.bewakoof.com/classic-t-shirt-for-women,Women's Red Super Girlfriend Typography T-shirt,₹264,"₹1,499",82% OFF,4.5
https://www.bewakoof.com/classic-t-shirt-for-women,Women's Blue & Green Striped Polo T-shirt,₹409,"₹1,249",67% OFF,4.5
https://www.bewakoof.com/half-sleeve-t-shirts-for-women,Women's Orange Boyfriend T-shirt,₹399,₹699,42% OFF,4.3
https://www.bewakoof.com/half-sleeve-t-shirts-for-women,Women's White Boyfriend T-shirt,₹399,₹999,60% OFF,4.3
https://www.bewakoof.com/half-sleeve-t-shirts-for-women,Women's Pink & White Camo Printed Oversized T-shirt,₹599,"₹1,149",47% OFF,4.3
https://www.bewakoof.com/half-sleeve-t-shirts-for-women,Women's Black & White All Over Printed Oversized T-shirt,₹599,₹999,40% OFF,4.3
https://www.bewakoof.com/half-sleeve-t-shirts-for-women,Women's Green Lavender Feels Graphic Printed Oversized T-shirt,₹599,"₹1,399",57% OFF,4.3
https://www.bewakoof.com/half-sleeve-t-shirts-for-women,Women's Red Pocket Jerry Graphic Printed Boyfriend T-shirt,₹499,"₹1,099",54% OFF,4.3
https://www.bewakoof.com/half-sleeve-t-shirts-for-women,Women's White Minimal Believe Typography Boyfriend T-shirt,₹449,"₹1,099",59% OFF,4.3
https://www.bewakoof.com/half-sleeve-t-shirts-for-women,Women's Ginger Root Brown Pocket Shine Graphic Printed Boyfriend T-shirt,₹449,"₹1,399",67% OFF,4.3
https://www.bewakoof.com/half-sleeve-t-shirts-for-women,Women's Brick Red Boyfriend T-shirt,₹399,"₹1,299",69% OFF,4.3
https://www.bewakoof.com/half-sleeve-t-shirts-for-women,Women's Black Boyfriend T-shirt,₹399,₹999,60% OFF,4.3
https://www.bewakoof.com/half-sleeve-t-shirts-for-women,Women's Orange Queen Bee Graphic Printed Oversized T-shirt,₹599,"₹1,499",60% OFF,4.3
https://www.bewakoof.com/half-sleeve-t-shirts-for-women,Women's Pink No Worries Graphic Printed Oversized T-shirt,₹699,"₹1,499",53% OFF,4.3
https://www.bewakoof.com/half-sleeve-t-shirts-for-women,Women's Black Patch Minion Graphic Printed Oversized T-shirt,₹599,"₹1,499",60% OFF,4.3
https://www.bewakoof.com/half-sleeve-t-shirts-for-women,Women's Azure Blue Cool Enough Graphic Printed Oversized T-shirt,₹599,"₹1,599",62% OFF,4.3
https://www.bewakoof.com/half-sleeve-t-shirts-for-women,Women's Lilac Bloom Grooving Typography Oversized T-shirt,₹599,"₹1,599",62% OFF,4.3
https://www.bewakoof.com/half-sleeve-t-shirts-for-women,Women's Orange Fresh As A Daisy Graphic Printed Boyfriend T-shirt,₹499,"₹1,299",61% OFF,4.3
https://www.bewakoof.com/half-sleeve-t-shirts-for-women,Women's Black Money Don't Jiggle Graphic Printed Boyfriend T-shirt,₹449,₹999,55% OFF,4.3
https://www.bewakoof.com/half-sleeve-t-shirts-for-women,Women's Orange Skool Graphic Printed Boyfriend T-shirt,₹499,"₹1,299",61% OFF,4.3
https://www.bewakoof.com/half-sleeve-t-shirts-for-women,Women's Red Bonjour Paris Graphic Printed Boyfriend T-shirt,₹449,"₹1,099",59% OFF,4.3
https://www.bewakoof.com/half-sleeve-t-shirts-for-women,Women's Blue Lazy Garfield Graphic Printed Oversized T-shirt,₹649,"₹1,349",51% OFF,4.3
https://www.bewakoof.com/women-pajamas,Women's Grey Mickey All Over Printed Wide Leg Pyjamas,₹649,"₹1,499",56% OFF,4.4
https://www.bewakoof.com/women-pajamas,Women's Brown Pyjamas,₹699,"₹1,149",39% OFF,4.4
https://www.bewakoof.com/women-pajamas,Women's Black Pyjamas,₹599,"₹1,149",47% OFF,4.4
https://www.bewakoof.com/women-pajamas,Women's Grey All Over Printed Wide Leg Pyjamas,₹599,"₹1,399",57% OFF,4.4
https://www.bewakoof.com/women-pajamas,Women's Blue Pyjamas,₹599,"₹1,199",50% OFF,4.4
https://www.bewakoof.com/women-pajamas,Women's Black Pyjamas,₹699,"₹1,299",46% OFF,4.4
https://www.bewakoof.com/women-pajamas,Women's White & Black All Over Printed Wide Leg Pyjamas,₹699,"₹1,499",53% OFF,4.4
https://www.bewakoof.com/women-pajamas,Women's Skipper Blue Pyjamas,₹499,"₹1,149",56% OFF,4.4
https://www.bewakoof.com/women-pajamas,Women's Purple & Blue Mickey All Over Printed Wide Leg Pyjamas,₹599,"₹1,499",60% OFF,4.4
https://www.bewakoof.com/women-pajamas,Women's Black All Over Printed Wide Leg Pyjamas,₹599,"₹1,399",57% OFF,4.4
https://www.bewakoof.com/women-pajamas,Women's White All Over Printed Oversized Pyjamas,₹409,"₹1,549",73% OFF,4.4
https://www.bewakoof.com/women-pajamas,Women's White Mickey All Over Printed Pyjamas,₹599,"₹1,249",52% OFF,4.4
https://www.bewakoof.com/women-pajamas,Women's Clear Sky Blue Garfield All Over Printed Wide Leg Pyjamas,₹799,"₹2,299",65% OFF,4.4
https://www.bewakoof.com/women-pajamas,Women's Blue All Over Printed Wide Leg Pyjamas,₹699,"₹2,299",69% OFF,4.4
